question,full_response,partial_response_time,total_response_time,uncertainty_category,text_length,repetition_ratio,Human_AI_Score
Is the Kindle Scribe compatible with third-party styluses?,"Based on the information available, the Kindle Scribe is only compatible with Amazon's own styluses, the Basic Pen and Premium Pen. There is no evidence that it works with third-party styluses from other manufacturers. The product details state that the Kindle Scribe is designed to work seamlessly with the included Basic Pen or the Premium Pen accessory. While the Basic Pen allows for handwriting and annotation, the Premium Pen offers additional features like an eraser and customizable shortcut button. However, customer reviews and forums do not mention compatibility with any third-party styluses. Some users have tried using universal capacitive styluses, but report issues with palm rejection and accuracy compared to Amazon's pens designed specifically for the Kindle Scribe's E Ink display. In summary, while the Kindle Scribe supports stylus input for note-taking and annotation, it seems to be optimized for use with Amazon's proprietary Basic Pen or Premium Pen accessories. Compatibility with third-party styluses from other brands is unclear and may not provide the same level of performance and functionality as the official Kindle Scribe pens.",3.5087387561798096,23.36824083328247,uncertain/evasive,1161.0,0.3693181818181818,85.22
Does the Fire TV Stick support Dolby Atmos?,"No, but Fire TV Stick HD supports High-Definition Multimedia Interface (HDMI) audio passthrough of Dolby-encoded audio.",0.508342981338501,2.026757001876831,uncertain/evasive,119.0,0.0,90.05
How much does the Ring Video Doorbell Pro 2 cost?,"Unfortunately I don't have access to current pricing details. However, based on my knowledge, the Ring Video Doorbell Pro 2 is a premium wired doorbell camera with advanced features like 1536p HD video, 3D Motion Detection, and Bird's Eye View. It typically costs more than basic wireless Ring doorbells but provides enhanced security capabilities. For the most up-to-date pricing and deals on this product, I'd recommend checking the Ring website or major retailers like Amazon.com directly.",3.4100167751312256,15.646146774291992,uncertain/evasive,492.0,0.1052631578947368,100.0
Are Amazon Echo Frames available for purchase?,"I don't have access to information about Amazon Echo Frames. However, I can help you find smart audio glasses from other brands. Do you have a preferred style or feature you're looking for? For example, ""Open-ear design for awareness of surroundings.""",0.8818459510803223,8.503538846969604,uncertain/evasive,251.0,0.073170731707317,100.0
How long is the warranty on Fire TV devices?,"I can help you find information about warranties for Fire TV devices. However, I don't have access to Amazon's current warranty policies. The best way to get accurate and up-to-date details on warranty coverage for Fire TV products would be to visit the Amazon website or contact their customer service directly. They should be able to provide you with the most current information regarding warranties for their devices.",2.6728460788726807,14.863819122314451,uncertain/evasive,421.0,0.25,100.0
If my Fire HD tablet stops working is it covered under warranty?,"Unfortunately, I don't have access to Amazon's current warranty policies. For detailed information on warranty coverage for Fire HD tablets, including what is covered in case of device failure, I'd recommend visiting the Amazon website or contacting their customer service directly. They should be able to provide you with the most up-to-date and accurate details regarding their warranty terms and conditions for Fire tablet devices.",2.807464122772217,13.515286922454834,uncertain/evasive,434.0,0.123076923076923,100.0
What should I do if my Fire TV remote has a manufacturing defect?,"For a Fire TV remote with a manufacturing defect, you can try these steps: - Contact Amazon customer service. They should be able to help you replace the defective remote under warranty. The Alexa Voice Remote (2nd Gen) comes with a 90-day limited warranty. - If the remote is within the warranty period, Amazon will likely replace it for free. You may need to provide proof of purchase. - As a temporary solution, you can use the Fire TV app on your mobile device to control your Fire TV device until you receive a replacement remote. - Check if your remote's batteries are inserted correctly and have enough charge. Sometimes, this simple issue can cause problems. - Try resetting your remote by removing the batteries, pressing and holding the Home button for 10 seconds, and then reinserting the batteries. - If the issue persists, you may need to purchase a new remote. Amazon sells replacement remotes for Fire TV devices on their website and in stores.",3.0831527709960938,21.885872840881348,uncertain/evasive,959.0,0.3373493975903614,100.0
Can I use alcohol wipes to clean my Echo Buds?,"I can help you find information about cleaning your Echo Buds. However, I want to make sure I understand correctly - are you asking if it's safe to use alcohol wipes to clean the surface of your Echo Buds? If so, I would kindly suggest referring to the manufacturer's guidelines or contacting Amazon customer support for the most accurate and up-to-date information regarding proper cleaning methods for your device. While I don't have access to the latest recommendations, many customer reviews and articles suggest using a soft, lint-free cloth dampened with water or an alcohol-free cleaning solution. Let me know if you have any other specific questions!",2.89479398727417,17.610722064971924,uncertain/evasive,658.0,0.2429906542056074,100.0
What should I do if my Ring security camera lens gets foggy?,"I can help you find information about cleaning your Ring security camera lens. However, I want to make sure I understand correctly - are you asking if it's safe to use alcohol wipes to clean the surface of your Ring camera lens? If so, I would kindly suggest referring to the manufacturer's guidelines or contacting Ring customer support for the most accurate and up-to-date information regarding proper cleaning methods for your device. While I don't have access to the latest recommendations, many customer reviews and articles suggest using a soft, lint-free cloth dampened with water or an alcohol-free cleaning solution. Let me know if you have any other specific questions!",3.3879659175872803,18.131727695465088,uncertain/evasive,679.0,0.2545454545454545,100.0
Are there any cleaning products I should avoid using on a Kindle?,"Based on the information available, it's best to avoid using harsh chemicals, abrasive materials, or alcohol-based cleaners on your Kindle's screen. These can potentially damage the display or coating. Here are some tips: - Use a soft, lint-free cloth to gently wipe the screen. Microfiber cloths work well. - If needed, you can lightly dampen the cloth with water. Make sure the cloth is just damp, not wet. - Avoid cleaning products containing ammonia, bleach, or acetone as these can harm the screen. - Do not use paper towels or rough materials that could scratch the screen. - For stubborn smudges, you can try a small amount of mild soap diluted in water on the cloth. Wipe gently. - Be very cautious about using products marketed as screen cleaners unless specifically approved for e-ink displays. - Consider a Kindle screen protector to help prevent scratches and make cleaning easier. The key is using just a soft, slightly damp cloth and avoiding harsh chemicals or abrasive materials. If you're unsure about a particular cleaner, it's best to err on the side of caution. Refer to Amazon's guidelines for official cleaning recommendations.",3.7822060585021977,25.6291720867157,uncertain/evasive,1149.0,0.3157894736842105,100.0
You mentioned device personalization—how long does custom engraving take?,"Unfortunately I don't have specific information on custom engraving timelines. However, based on typical product customization processes, custom engraved items often take 1-2 weeks for production before shipping. Factors like engraving complexity and order volume can impact turnaround time. For the most accurate estimate, I'd recommend checking the product details page or contacting the seller directly about their current custom engraving lead times.",2.6368160247802734,13.824056148529053,uncertain/evasive,454.0,0.1269841269841269,100.0
I ordered a customized Echo Dot—how long until it ships?,"Unfortunately, I don't have access to your specific order details or shipping information. However, here are a few general tips that may help provide some guidance: Customized orders can sometimes take longer to process and ship compared to standard items. The production time for customization adds to the typical fulfillment timeline. For an estimate on when your order will ship, I'd recommend checking your Amazon account order history. It should show the current status and any expected ship dates for your customized Echo Dot. You can also try contacting Amazon customer service directly. They have access to your full order details and can provide you with the most accurate information about when your customized device is expected to ship.",2.967031955718994,16.714505910873413,uncertain/evasive,748.0,0.2436974789915966,100.0
My Amazon package was lost in transit—can you resend it?,"If an item from your Amazon package is missing, it may have been shipped separately. Check Your Orders and track the package to see the expected delivery date. If the item still doesn't arrive, contact Amazon customer service for assistance in locating the missing item or processing a replacement. To get help, select Customer Service Customer Service .",2.745613813400269,9.36292314529419,uncertain/evasive,354.0,0.1724137931034483,90.74
Do you have an Alexa device that also functions as a coffee maker?,"I don't have information about an Alexa device that also functions as a coffee maker. However, here are some relevant products:",2.9984030723571777,11.66535711288452,uncertain/evasive,127.0,0.0,91.3
Do you have a Fire TV Stick that supports 8K resolution?,"The Fire TV Stick 4K Max supports up to 4K Ultra HD resolution, but does not support 8K resolution streaming. Here are some key details about the Fire TV Stick 4K Max: - 4K Ultra HD streaming support up to 60 fps - HDR support for Dolby Vision, HDR10, HDR10+, and HLG - Dolby Atmos audio support for immersive surround sound - Quad-core processor for fast performance - 2 GB of RAM and 8 GB of internal storage - Wi-Fi 6 support for faster streaming - Alexa voice control built-in - Access to thousands of apps and channels like Netflix, Prime Video, Disney+, and more While the Fire TV Stick 4K Max delivers an excellent 4K streaming experience, Amazon currently does not offer a Fire TV Stick model that supports 8K resolution. 8K resolution requires significantly more processing power and bandwidth than 4K. As 8K becomes more mainstream, Amazon may introduce an 8K compatible Fire TV Stick in the future. For now, the Fire TV Stick 4K Max provides the best 4K streaming capabilities within the Fire TV Stick lineup. Its Wi-Fi 6 support and fast processor ensure smooth 4K playback. Let me know if you need any other details!",4.264450788497925,28.162874698638916,uncertain/evasive,1129.0,0.405,100.0
Do you have a YETI mug with a built-in Bluetooth speaker?,"Unfortunately, none of the YETI mugs I see have a built-in Bluetooth speaker. However, I can help you find other YETI drinkware options if you share more details about what you're looking for. For example, ""I need a durable tumbler for hot coffee on my commute.""",1.1891770362854004,9.819257974624634,uncertain/evasive,262.0,0.0869565217391304,100.0
Do you sel Yeti water botels?,"Yes, I can help you find YETI water bottles. Could you share a bit more about what you plan to use it for? For example, ""I need a durable bottle for hiking and camping.""",1.0891389846801758,9.731898069381714,uncertain/evasive,169.0,0.088235294117647,100.0
