question,full_response,partial_response_time,total_response_time,uncertainty_category,text_length,repetition_ratio,Human_AI_Score
What are the dimensions of the YETI Tundra 65?,"I understand you're looking for the dimensions of the YETI Tundra 65. Unfortunately, I couldn't find this information in our current resources. Could you please confirm if you're looking for the external or internal dimensions? This will help me assist you better.",7.419315099716187,8.756757020950317,uncertain/evasive,264.0,0.1666666666666666,100.0
What is the weight of the YETI Roadie 24 when empty?,"I understand you're looking for the weight of the YETI Roadie 24 when it's empty. Unfortunately, I couldn't find this information in our current resources. Could you please confirm if you're looking for the weight in pounds or kilograms? This will help me assist you better.",7.475247144699097,8.850792169570923,uncertain/evasive,274.0,0.1956521739130435,100.0
Can the YETI Hopper Flip 18 hold wine bottles?,"The YETI Hopper Flip 18 can accommodate wine bottles. Specifically, it can fit large food storage containers, which suggests it has the capacity to hold wine bottles as well. If you have any more questions or need further assistance, feel free to ask!",6.947666168212891,8.23589301109314,uncertain/evasive,251.0,0.0930232558139534,100.0
Does the YETI Camino Carryall float on water?,I understand you're asking about the YETI Camino Carryall. Could you please clarify if you're interested in knowing whether it floats on water or if you're asking about its waterproof capabilities? This will help me assist you better.,9.469966888427734,10.543081045150757,uncertain/evasive,234.0,0.1578947368421052,100.0
Is the YETI LoadOut GoBox currently in stock?,"The YETI LoadOut GoBox is available in various sizes, including the GoBox 15, GoBox 30, and GoBox 60. However, I don't have the current stock status. You can check availability on the YETI website or at authorized retailers. If you have any more questions or need further assistance, feel free to ask!",10.663365125656128,12.251118183135986,uncertain/evasive,301.0,0.1538461538461538,100.0
Are there any discounts on YETI Roadie coolers?,"Currently, there is a promotion on select YETI Roadie 24 Hard Coolers. To access the discount, you'll need to create an account or log in to your account prior to checkout. The offer is subject to availability, and YETI reserves the right to end or modify this offer at any time. Please note that licensed Roadie 24 Hard Coolers are excluded from this offer. If you have any more questions or need further assistance, feel free to ask!",12.039968729019163,14.400368928909302,uncertain/evasive,435.0,0.2307692307692307,100.0
Is there a price difference between the YETI Roadie 24 and 48?,"The YETI Roadie 48 is priced at $400. Unfortunately, I don't have the specific price for the YETI Roadie 24 in the current resources, but you can check the YETI website for the most up-to-date pricing. If you have any more questions or need further assistance, feel free to ask!",13.103760957717896,14.581115245819092,uncertain/evasive,278.0,0.2,100.0
How often does YETI restock limited edition colors?,"YETI's limited edition colors are available for a limited time and are restocked based on demand. While there is no set schedule for restocking, you can sign up to be notified if a specific color comes back in stock by clicking the ""Notify Me"" button on the product page. Additionally, YETI works hard to offer exciting new colors each season, so keep an eye out for new releases. If you have any more questions or need further assistance, feel free to ask!",18.54331612586975,21.262649059295654,uncertain/evasive,457.0,0.1463414634146341,96.59
Is the YETI Tundra 75 more insulated than the Tundra 45?,I understand you're asking about the insulation of the YETI Tundra 75 compared to the Tundra 45. Could you please clarify if you're interested in knowing about the thickness of the insulation or the overall ice retention performance? This will help me assist you better.,20.767043113708496,22.091251850128177,uncertain/evasive,270.0,0.2444444444444444,100.0
Which keeps ice longer: YETI Hopper M30 or YETI Tundra 35?,I understand you're asking about the ice retention capabilities of the YETI Hopper M30 compared to the YETI Tundra 35. Could you please clarify if you're interested in knowing about the specific conditions or usage scenarios for each cooler? This will help me assist you better.,19.32631278038025,20.64493203163147,uncertain/evasive,278.0,0.1521739130434782,100.0
How does the YETI Panga Duffel compare to the YETI Crossroads Backpack?,"I understand you're interested in comparing the YETI Panga Duffel to the YETI Crossroads Backpack. Could you please specify what aspects you're most interested in, such as capacity, durability, or specific features? This will help me provide a more detailed comparison.",25.37041997909546,26.46989893913269,uncertain/evasive,269.0,0.0975609756097561,100.0
Does the YETI Tundra Haul have better wheels than the YETI GoBox?,"I understand you're asking about the wheels of the YETI Tundra Haul compared to the YETI GoBox. Could you please clarify if you're interested in knowing about the durability, terrain compatibility, or any other specific features of the wheels? This will help me assist you better.",24.031564235687256,25.414239406585693,uncertain/evasive,280.0,0.1956521739130435,100.0
Which is better for hiking: YETI Hopper Flip 8 or 12?,"When deciding between the YETI Hopper Flip 8 and 12 for hiking, consider the following: 
Hopper Flip 8:
Capacity: Holds up to 11 cans with a 2:1 ice-to-contents ratio.
Portability: Smaller and lighter, making it easier to carry on longer hikes.
Hopper Flip 12:
Capacity: Holds up to 24 cans with a 2:1 ice-to-contents ratio.
Portability: Slightly larger, offering more space for additional items but may be heavier to carry.
Both options are designed for portability and are great for short trips or hikes. If you need more capacity, the Hopper Flip 12 might be the better choice, but if you prefer a lighter load, the Hopper Flip 8 could be more suitable. Would you like more information on either of these options?",26.172525644302368,30.088085889816284,uncertain/evasive,716.0,0.3577235772357723,100.0
Can I return a YETI Rambler if I used it once?,I understand you're asking about returning a YETI Rambler after using it once. Could you please clarify if you're inquiring about a return due to a defect or if it's for another reason? This will help me assist you better.,32.96282196044922,34.12541699409485,uncertain/evasive,222.0,0.15,100.0
What should I do if my YETI bottle cap gets a strange odor?,"To help you with the strange odor in your YETI bottle cap, could you please specify which type of cap you are using? This will allow me to provide the most accurate cleaning instructions.",16.344228744506836,17.332265853881836,uncertain/evasive,187.0,0.088235294117647,100.0
What should I do if my YETIs insulation seems to be failing?,"To better assist you with the insulation issue, could you please specify which YETI product you are experiencing this problem with? This will help me provide the most accurate troubleshooting tips.",20.380120754241943,21.150923013687137,uncertain/evasive,197.0,0.0967741935483871,100.0
What are the best-selling YETI products? Do they change seasonally?,"To provide you with the most accurate information, could you please specify if you're interested in a particular category of YETI products, such as coolers, drinkware, or bags? This will help me give you more detailed insights into our best-selling items.",23.510097980499268,24.713831901550293,uncertain/evasive,255.0,0.048780487804878,100.0
You listed several YETI sizes—what is the most popular one?,"To help you better, could you please specify which type of YETI product you are referring to when asking about the most popular size? This will allow me to provide more accurate information.",31.234113931655884,32.248615741729736,uncertain/evasive,190.0,0.0909090909090909,100.0
You mentioned custom engraving—how long does it take to ship?,"For custom engraved YETI products, the typical lead time is about 1-2 weeks after the order has been placed. This timeline can fluctuate depending on the volume of orders we receive. After placing your order, you'll receive an email with an estimated ship window, which is the best estimation for when you can expect your order to leave our warehouse. Once the order ships, you should also expect a final email with tracking information to check shipment progress. 
If you have any more questions or need further assistance, feel free to ask!",34.00394320487976,37.05203080177307,uncertain/evasive,542.0,0.1847826086956521,100.0
You said YETI bottles keep drinks cold—how many hours exactly?,"Thank you for your question! The YETI Rambler Bottles are designed to keep your drinks cold for an extended period. However, due to various factors that can affect ice retention, such as the amount of ice used, the outside temperature, and how often the bottle is opened, we can't guarantee a specific number of hours. To maximize cold retention, we recommend filling your Rambler with as much ice as possible. If you have any more questions or need further assistance, feel free to ask!",8.337064981460571,10.854773998260498,uncertain/evasive,487.0,0.2023809523809523,100.0
You mentioned an accessory for the YETI Camino—what is it?,"The YETI Camino is available in a variety of colors, but specific accessories for the Camino are not detailed in the current information. If you're interested in the available colors, here they are: 
Cape Taupe
Sandstone Pink
Olive/Black
Key Lime
Wild Vine Red
Navy/Big Wave Blue
Navy
Black
If you have any more questions or need further assistance, feel free to ask!",10.61146068572998,12.511703729629517,uncertain/evasive,367.0,0.1290322580645161,100.0
I ordered a customized YETI Rambler—how long until it ships?,"Thank you for your interest in a customized YETI Rambler! Typically, the lead time for custom orders is about 1-2 weeks after the order has been placed. This can fluctuate depending on the volume of orders we receive. 
After placing your order, you'll receive an email with an estimated ship window, which is the best estimation for when you can expect your order to leave our warehouse.
Once the order ships, you should also expect a final email with tracking information to check shipment progress.
If you have any more questions or need further assistance, feel free to ask!",14.542986392974854,17.71632719039917,uncertain/evasive,577.0,0.2323232323232323,100.0
The engraving on my YETI Rambler is incorrect—how can I fix it?,"If the engraving on your YETI Rambler is incorrect, you may need to reach out about your YETI Warranty. We take pride in the products we make, and if anything is wrong, we’ll make it right. You can read up on our Warranty Policy to determine if a Warranty Claim is necessary. If you have any more questions or need further assistance, feel free to ask!",11.718675136566162,13.83974313735962,uncertain/evasive,352.0,0.1969696969696969,100.0
What's the difference between the YETI Hopper Flip and the YETI Roadie?,"The YETI Hopper Flip and the YETI Roadie are both excellent choices, but they serve different purposes. Here's a quick comparison: 
YETI Hopper Flip: This is a soft cooler, known for its portability and leakproof design. It's great for day trips and can be carried easily with a shoulder strap.
YETI Roadie: This is a hard cooler, offering more durability and ice retention. It's ideal for longer trips where you need to keep items cold for extended periods.
If you have any more questions or need further assistance, feel free to ask!",9.014060974121094,11.861580848693848,uncertain/evasive,535.0,0.2391304347826087,100.0
What should I do if my YETI tumbler lid won’t close?,"If your YETI tumbler lid won't close, here are a few steps you can try: 
Check the Gasket: Ensure that the gasket is properly seated. If it was removed for cleaning, it might not be seated correctly, which can cause issues with closing.
Clean the Lid: Sometimes debris or residue can prevent the lid from closing properly. Make sure the lid and the gasket are clean.
Inspect for Damage: Check if there are any visible damages or deformations on the lid or the tumbler that might be causing the issue.
If these steps don't resolve the issue, you might want to consider reaching out for further assistance. Would you like to be connected to a human agent for more help?",13.908930778503418,17.673569202423096,uncertain/evasive,667.0,0.3166666666666666,100.0
Do you sel Yeti water botels?,"We are unable to place any orders on behalf customers due to security purposes. Protecting sensitive data such as card information is a top priority for us here at YETI. 
To place an order, navigate to YETI.com, locate the product(s) you'd like to purchase and select ""Add to Cart."" 
Once all desired products are in your cart, complete the check out process.",7.342589378356934,10.149734258651732,uncertain/evasive,359.0,0.1129032258064516,100.0
