Category,Question,cleaned_question,Cluster
Product Information,What are the size options for the Fi Dog Collar?,size options brand dog product,4
Product Information,Is the Fi Collar waterproof?,brand product waterproof,0
Product Information,What is the battery life of the Fi Series 3?,battery life brand model 3,1
Product Information,Can the Fi Collar be used for cats?,brand product used cats,0
Product Information,What materials are used in the Fi Dog Collar?,materials used brand dog product,0
Product Information,Does the Fi Collar come in different colors?,brand product come different colors,4
Product Information,How accurate is the Fi Collar's GPS tracking?,accurate brand product gps tracking,2
Product Information,Is the Fi Collar suitable for small dogs?,brand product suitable small dogs,2
Product Information,Can I use the Fi Collar without a subscription?,use brand product without subscription,4
Product Information,How much does the Fi Collar weigh?,much brand product weigh,4
Pricing & Availability,Is the Fi Collar Series 3 currently in stock?,brand product model 3 currently stock,4
Pricing & Availability,Does Fi offer any discounts for multiple collars?,brand offer discounts multiple product,4
Pricing & Availability,How much does a Fi Collar subscription cost?,much brand product subscription cost,4
Pricing & Availability,Does Fi offer a money-back guarantee?,brand offer moneyback guarantee,4
Pricing & Availability,Can I purchase a replacement module for my Fi Collar?,purchase replacement module brand product,4
Pricing & Availability,Are there any Black Friday or holiday deals on Fi Collars?,black friday holiday deals brand product,4
Pricing & Availability,Is there a price difference between Fi Collar Series 2 and Series 3?,price difference brand product model 2 model 3,4
Pricing & Availability,Does Fi offer a referral program for discounts?,brand offer referral program discounts,4
Pricing & Availability,Are Fi gift cards available for purchase?,brand gift cards available purchase,4
Pricing & Availability,How often does Fi update pricing or subscription plans?,often brand update pricing subscription plans,4
Comparisons,What is the difference between Fi Collar Series 2 and Series 3?,difference brand product model 2 model 3,4
Comparisons,How does Fi compare to the Whistle GPS Collar?,brand compare whistle gps product,2
Comparisons,Does the Fi Collar have better battery life than Tractive?,brand product better battery life tractive,1
Comparisons,Which has better GPS tracking: Fi or Apple AirTag?,better gps tracking brand brand product,2
Comparisons,Is the Fi Collar more durable than standard dog collars?,brand product durable standard dog product,1
Comparisons,Does Fi track health data like the FitBark?,brand track health data like product,4
Comparisons,How does Fi's escape detection compare to competitors?,brand escape detection compare competitors,4
Comparisons,Which is better for off-leash training: Fi or Garmin?,better offleash training brand Brand,4
Comparisons,Is the Fi Collar's Bluetooth range better than the Halo Collar?,brand product bluetooth range better brand product,2
Comparisons,Does the Fi Collar work better in rural areas than urban ones?,brand product work better rural areas urban ones,2
Warranties & Returns,How long is the warranty on Fi Collars?,long warranty brand product,1
Warranties & Returns,Does Fi cover accidental damage under warranty?,brand cover accidental damage warranty,1
Warranties & Returns,Can I return a Fi Collar if my dog doesnt like it?,return brand product dog doesnt like,1
Warranties & Returns,What is Fi's policy on defective products?,brand policy defective products,1
Warranties & Returns,Does Fi require proof of purchase for warranty claims?,brand require proof purchase warranty claims,1
Warranties & Returns,Can I return a Fi Collar if the GPS tracking is inaccurate?,return brand product gps tracking inaccurate,3
Warranties & Returns,Does Fi offer extended warranty plans?,brand offer extended warranty plans,1
Warranties & Returns,What should I do if my Fi Collar stops charging?,brand product stops charging,1
Warranties & Returns,Are customized Fi Collars eligible for returns?,customized brand product eligible returns,4
Warranties & Returns,Does Fi cover lost or stolen collars under warranty?,brand cover lost stolen product warranty,1
Care & Maintenance,How should I clean my Fi Collar?,clean brand product,0
Care & Maintenance,Can I submerge the Fi Collar in water?,submerge brand product water,0
Care & Maintenance,What should I do if my Fi Collar gets muddy?,brand product gets muddy,0
Care & Maintenance,How do I replace the Fi Collar band?,replace brand product band,1
Care & Maintenance,What should I do if the Fi GPS signal is weak?,brand gps signal weak,2
Care & Maintenance,Can I use any third-party bands with the Fi Collar?,use thirdparty bands brand product,2
Care & Maintenance,What should I do if my Fi Collar doesnt charge?,brand product doesnt charge,1
Care & Maintenance,Are there any cleaning products I should avoid using on the Fi Collar?,cleaning products avoid using brand product,0
Care & Maintenance,Can I wash my Fi Collar in the washing machine?,wash brand product washing machine,0
Care & Maintenance,What should I do if my Fi Collar loses connection frequently?,brand product loses connection frequently,1
Multi-step Inquiries,Does the Fi Collar track sleep? If so how accurate is it?,brand product track sleep accurate,2
Multi-step Inquiries,What colors does the Fi Collar come in? Can I customize it?,colors brand product come customize,4
Multi-step Inquiries,Can I share Fi Collar access with family members? How does it work?,share brand product access family members work,2
Multi-step Inquiries,Does the Fi Collar require Wi-Fi? If so why?,brand product require wifi,2
Multi-step Inquiries,What happens if my Fi Collar battery dies? Will it still track?,happens brand product battery dies still track,1
Multi-step Inquiries,Can I use Fi without a phone? What are the limitations?,use brand without phone limitations,2
Multi-step Inquiries,What are the best accessories for the Fi Collar? Are they necessary?,best accessories brand product necessary,2
Multi-step Inquiries,Can I add multiple dogs to one Fi account? How does it work?,add multiple dogs one brand account work,2
Multi-step Inquiries,Does the Fi Collar track my dog indoors? If so how accurate is it?,brand product track dog indoors accurate,2
Multi-step Inquiries,How does the Fi Collar notify me if my dog escapes? Can I customize alerts?,brand product notify dog escapes customize alerts,2
Follow-ups,You mentioned Fi uses GPS—does it work in remote areas?,mentioned brand uses gps—does work remote areas,2
Follow-ups,You said the Fi Collar is durable—can it withstand chewing?,said brand product durable—can withstand chewing,1
Follow-ups,You listed Fis battery life—what factors affect it?,listed brand battery life—what factors affect,1
Follow-ups,You said the Fi Collar can be tracked in real-time—how often does it update?,said brand product tracked realtime—how often update,2
Follow-ups,You mentioned Fi has activity tracking—does it show calories burned?,mentioned brand activity tracking—does show calories burned,2
Follow-ups,You said the Fi Collar connects to Wi-Fi—can I use multiple networks?,said brand product connects wifi—can use multiple networks,2
Follow-ups,You listed Fis escape alerts—how fast does it notify me?,listed brand escape alerts—how fast notify,2
Follow-ups,You said the Fi Collar can share location—how many people can access it?,said brand product share location—how many people access,2
Follow-ups,You mentioned Fis geofencing—can I set multiple safe zones?,mentioned brand geofencing—can set multiple safe zones,2
Follow-ups,You said Fi supports multiple pets—how does it track each separately?,said brand supports multiple pets—how track separately,2
Order Status,Can you check my Fi order? I need to change my shipping address.,check brand order need change shipping address,3
Order Status,My Fi order is delayed—can you give me an update?,brand order delayed—can give update,3
Order Status,I ordered a replacement Fi module—how long will it take to ship?,ordered replacement brand module—how long take ship,3
Order Status,Can I track my Fi order in real-time?,track brand order realtime,3
Order Status,Does Fi allow order cancellations before shipping?,brand allow order cancellations shipping,3
Escalation & Handoff,My Fi Collar isnt tracking properly—what should I do?,brand product isnt tracking properly—what,3
Escalation & Handoff,The wrong size Fi Collar was sent—can I exchange it?,wrong size brand product sent—can exchange,3
Escalation & Handoff,My Fi Collars battery isnt holding a charge—can I get a replacement?,brand product battery isnt holding charge—can get replacement,1
Escalation & Handoff,The Fi app isnt working for me—can you escalate my case?,brand app isnt working me—can escalate case,3
Escalation & Handoff,My Fi Collar stopped updating GPS—can I speak to a specialist?,brand product stopped updating gps—can speak specialist,3
Error Handling,Does Fi offer a solar-powered GPS collar?,brand offer solarpowered gps product,2
Error Handling,Can I buy a Fi Collar with built-in heart rate tracking?,buy brand product builtin heart rate tracking,2
Error Handling,Is there a Fi Collar model that lets my dog talk back?,brand product model lets dog talk back,2
Error Handling,Do you sell Fi Collars for horses?,sell brand product horses,4
Error Handling,Is there a Fi Collar that also dispenses treats?,brand product also dispenses treats,4
